{
  "activatedAt": null,
  "anchorDigest": "sha256:e57aab772793a1d2b214c71a2aa8e5e8da8d6086cb3e68e1f415152eb23b2701",
  "anchorSequence": 0,
  "artifactDigest": null,
  "artifactName": null,
  "canonicalRecordSetDigest": null,
  "componentInventoryDigest": null,
  "contentStatus": "genesis",
  "initialized": false,
  "kind": "stable-1.0-dependency-intelligence-source-lineage-anchor",
  "policyDigest": "sha256:1cc578a558d5a96c68207ad0f87055330a493b2796856460aa3973670aa412bc",
  "previousAnchorDigest": null,
  "producerWorkflow": null,
  "rawContentDigest": null,
  "repositoryIdentity": "github.com/crypta-network/cryptad",
  "retrievalValidation": "none",
  "retrievedAt": null,
  "runAttempt": null,
  "runId": null,
  "schemaVersion": 1,
  "sourceId": "reviewed-vendor-records",
  "sourceSnapshotDigest": null,
  "workflowCommit": null
}
