{
  "activatedAt": null,
  "anchorDigest": "sha256:f00b569622157e03827741ab9bc0c74b3d34d665fd4a730a279a4c226b84862c",
  "anchorSequence": 0,
  "artifactDigest": null,
  "artifactName": null,
  "canonicalRecordSetDigest": null,
  "componentInventoryDigest": null,
  "contentStatus": "genesis",
  "initialized": false,
  "kind": "stable-1.0-dependency-intelligence-source-lineage-anchor",
  "policyDigest": "sha256:1cc578a558d5a96c68207ad0f87055330a493b2796856460aa3973670aa412bc",
  "previousAnchorDigest": null,
  "producerWorkflow": null,
  "rawContentDigest": null,
  "repositoryIdentity": "github.com/crypta-network/cryptad",
  "retrievalValidation": "none",
  "retrievedAt": null,
  "runAttempt": null,
  "runId": null,
  "schemaVersion": 1,
  "sourceId": "github-public-advisories",
  "sourceSnapshotDigest": null,
  "workflowCommit": null
}
