{
  "activatedAt": null,
  "anchorDigest": "sha256:0211ebd777e4c36b6b4bc4f20ecdce13fafff48c21f93e11a0709aba2a12e7be",
  "anchorSequence": 0,
  "artifactDigest": null,
  "artifactName": null,
  "canonicalRecordSetDigest": null,
  "componentInventoryDigest": null,
  "contentStatus": "genesis",
  "initialized": false,
  "kind": "stable-1.0-dependency-intelligence-source-lineage-anchor",
  "policyDigest": "sha256:1cc578a558d5a96c68207ad0f87055330a493b2796856460aa3973670aa412bc",
  "previousAnchorDigest": null,
  "producerWorkflow": null,
  "rawContentDigest": null,
  "repositoryIdentity": "github.com/crypta-network/cryptad",
  "retrievalValidation": "none",
  "retrievedAt": null,
  "runAttempt": null,
  "runId": null,
  "schemaVersion": 1,
  "sourceId": "osv-public",
  "sourceSnapshotDigest": null,
  "workflowCommit": null
}
